,title,selftext,author,subreddit,created_utc,upvote_ratio,num_comments,permalink,url
0,Saturday Morning Political Cartoon Thread,"It's Saturday, folks. Let's all kick back with a cup of coffee and share some cartoons!

Feel free to share political cartoons in this thread. Besides our usual civility policy, there are three rules to follow:

1. Every top-level comment must contain a political cartoon. This means no text-only top-level comments.


2. It must be an original cartoon. This means no photographs, no edited cartoons, no AI generated images, no templates, no memes and no image macros. OC is allowed, as is animation.


3. Each top-level comment should only have a maximum of 3 cartoons. 


That's all. Enjoy your weekend!",optimalg,politics,1695481494.0,0.84,78,/r/politics/comments/16q6t37/saturday_morning_political_cartoon_thread/,https://www.reddit.com/r/politics/comments/16q6t37/saturday_morning_political_cartoon_thread/
1,Ramaswamy wants to end the H-1B visa program he used 29 times,,A-Dog22,politics,1695602907.0,0.97,225,/r/politics/comments/16rdzzm/ramaswamy_wants_to_end_the_h1b_visa_program_he/,https://www.politico.com/news/2023/09/16/ramaswamy-h1b-visa-gop-visa-00116383
2,Trump Slapped With Order Banning Threats and Intimidation,,mps1729,politics,1695576103.0,0.94,1465,/r/politics/comments/16r39jk/trump_slapped_with_order_banning_threats_and/,https://www.rollingstone.com/politics/politics-news/trump-protective-order-colorado-ballot-1234830130/
3,A South Carolina GOP lawmaker says he's a 'strong advocate' for family values. His wife says he's had multiple affairs and is filing for divorce.,,thisisinsider,politics,1695583477.0,0.98,181,/r/politics/comments/16r69rz/a_south_carolina_gop_lawmaker_says_hes_a_strong/,https://www.businessinsider.com/family-values-gop-senator-jeff-duncan-multiple-affairs-wife-divorce-2023-9?utm_source=reddit&utm_medium=social&utm_campaign=insider-politics-sub-post
4,‘They’re already putting this plan into action’: The chilling truth about Project 2025’s radical agenda,,prohb,politics,1695581161.0,0.98,280,/r/politics/comments/16r5btk/theyre_already_putting_this_plan_into_action_the/,https://www.msnbc.com/ali-velshi/watch/-they-re-already-putting-this-plan-into-action-the-chilling-truth-about-project-2025-s-radical-agenda-193655877904
5,Fetterman becomes first Democratic senator to demand Bob Menendez resign over corruption charges,,RecordingFancy8515,politics,1695582943.0,0.98,92,/r/politics/comments/16r627c/fetterman_becomes_first_democratic_senator_to/,https://www.businessinsider.com/fetterman-is-first-democratic-senator-to-demand-bob-menendez-resign-2023-9
6,The Open Plot to Dismantle the Federal Government | “I can’t overstate my level of concern about the damage this would do.”,,Hrmbee,politics,1695594012.0,0.98,92,/r/politics/comments/16raniq/the_open_plot_to_dismantle_the_federal_government/,https://www.theatlantic.com/politics/archive/2023/09/trump-desantis-republicans-dismantle-deep-state/675378/
7,'Extremely Serious': AOC Becomes First House Progressive to Call for Menendez Resignation,,Huplescat22,politics,1695593369.0,0.96,63,/r/politics/comments/16rae7p/extremely_serious_aoc_becomes_first_house/,https://www.commondreams.org/news/ocasio-cortez-menendez
8,"Poll showing Trump up 10 points over Biden for 2024 election criticized | A Washington Post-ABC poll showed results that diverge from most other surveys, and even the pollers made a caveat",,Picture-unrelated,politics,1695589673.0,0.92,448,/r/politics/comments/16r8u6z/poll_showing_trump_up_10_points_over_biden_for/,https://www.theguardian.com/us-news/2023/sep/24/washington-post-abc-poll-trump-10-points-over-biden
9,"Column: Trump has a second-term agenda, and it's more terrifying than ever",,tstyes,politics,1695576142.0,0.96,223,/r/politics/comments/16r3a3l/column_trump_has_a_secondterm_agenda_and_its_more/,https://www.latimes.com/politics/story/2023-09-24/mcmanus-column-trump-second-term-agenda
10,Trump aide claims Mark Meadows was burning so many documents his wife complained of ‘bonfire’ smell,,Picture-unrelated,politics,1695584704.0,0.98,51,/r/politics/comments/16r6rg5/trump_aide_claims_mark_meadows_was_burning_so/,https://www.the-independent.com/news/world/americas/us-politics/mark-meadows-trump-cassidy-hutchinson-b2417596.html
11,Bidenomics’ is a godsend for rural America,,aslan_is_on_the_move,politics,1695572332.0,0.92,397,/r/politics/comments/16r1pzo/bidenomics_is_a_godsend_for_rural_america/,https://thehill.com/opinion/finance/4214107-what-does-bidenomics-mean-for-rural-america/
12,"Swalwell: McCarthy shares Speakership with Trump, Greene and Gaetz",,davster39,politics,1695598187.0,0.97,44,/r/politics/comments/16rc9lu/swalwell_mccarthy_shares_speakership_with_trump/,https://thehill.com/homenews/house/4220900-swalwell-mccarthy-shares-speakership-with-trump-greene-and-gaetz/
13,"A Batman researcher said 'gay' in a talk to students. When asked to censor himself, he quit. Eleven states ban discussion of LGBTQ people in at least some public schools in what are often called “don’t say gay” laws, according to the Movement Advancement Project.",,southpawFA,politics,1695591013.0,0.96,132,/r/politics/comments/16r9egy/a_batman_researcher_said_gay_in_a_talk_to/,https://www.nbcnews.com/nbc-out/out-news/batman-researcher-said-gay-talk-students-asked-censor-quit-rcna107970?ex=digest
14,Clarence Thomas spent time at the Koch Brothers' version of Coachella. Something tells us they weren't making each other flower crowns.,,rillzy,politics,1695560793.0,0.97,144,/r/politics/comments/16qxc22/clarence_thomas_spent_time_at_the_koch_brothers/,https://www.businessinsider.com/clarence-thomas-coachella-valley-koch-brothers-event-2023-9
15,Ron DeSantis probably didn't turn Florida red,,kpDzYhUCVnUJZrdEJRni,politics,1695577124.0,0.96,136,/r/politics/comments/16r3o5x/ron_desantis_probably_didnt_turn_florida_red/,https://abcnews.go.com/538/ron-desantis-turn-florida-red/story?id=103096560
16,Sen. Whitehouse: 'Very possible illegal conduct' in billionaires' SCOTUS gifts,,Alarming-Inflation90,politics,1695562787.0,0.98,131,/r/politics/comments/16qy04p/sen_whitehouse_very_possible_illegal_conduct_in/,https://www.msnbc.com/the-last-word/watch/sen-whitehouse-very-possible-illegal-conduct-in-billionaires-scotus-gifts-193333317803
17,Anti-vaxxers are now a modern political force - The once-fringe movement is now seeing an influx in cash after the Covid pandemic.,,Quirkie,politics,1695564248.0,0.95,554,/r/politics/comments/16qyjhi/antivaxxers_are_now_a_modern_political_force_the/,https://www.politico.com/news/2023/09/24/anti-vaxxers-political-power-00116527
18,New Justice Thomas scandal points to next target of billionaires' Supreme Court influence,,Nearby-Astronomer298,politics,1695583857.0,0.97,31,/r/politics/comments/16r6fcj/new_justice_thomas_scandal_points_to_next_target/,https://www.msnbc.com/alex-wagner-tonight/watch/new-justice-thomas-scandal-points-to-next-target-of-billionaires-supreme-court-influence-193605701590
19,A monopoly-busting Amazon lawsuit might be Biden’s boldest move yet to tame tech,,newnemo,politics,1695559765.0,0.98,117,/r/politics/comments/16qwz76/a_monopolybusting_amazon_lawsuit_might_be_bidens/,https://www.politico.com/news/2023/09/22/lawsuit-against-amazon-expected-next-week-00117609
20,"GOP congressman dismisses anti-McCarthy insurgents, says '95% should not cower' to 5 people",,jgeorge20,politics,1695594246.0,0.9,70,/r/politics/comments/16raqyr/gop_congressman_dismisses_antimccarthy_insurgents/,https://www.foxnews.com/politics/gop-congressman-dismisses-anti-mccarthy-insurgents-95-should-not-cower-5-people
21,By the Numbers: Impacts of House Republicans’ Extreme CR 8% Cuts,,not_a_bug_a_feature,politics,1695606369.0,0.97,37,/r/politics/comments/16rf5wm/by_the_numbers_impacts_of_house_republicans/,https://www.whitehouse.gov/briefing-room/statements-releases/2023/09/19/by-the-numbers-impacts-of-house-republicans-extreme-cr-8-cuts/
22,Democratic senators reluctant to join John Fetterman in calling for Bob Menendez's resignation,,Separate_Explorer300,politics,1695612078.0,0.91,80,/r/politics/comments/16rh49f/democratic_senators_reluctant_to_join_john/,https://www.nbcnews.com/politics/congress/democratic-senators-reluctant-join-calls-bob-menendezs-resignation-rcna117075
23,Republicans appeal to far-right conservatives to avert US government shutdown,,Remarkable-Scratch50,politics,1695585215.0,0.97,79,/r/politics/comments/16r6yr0/republicans_appeal_to_farright_conservatives_to/,https://www.reuters.com/world/us/republicans-appeal-far-right-conservatives-avert-us-government-shutdown-2023-09-24/
24,"Government shutdown set for next weekend, barring surpise budget deal",,smantright,politics,1695601837.0,0.96,38,/r/politics/comments/16rdlo0/government_shutdown_set_for_next_weekend_barring/,https://www.militarytimes.com/news/pentagon-congress/2023/09/25/government-shutdown-set-for-next-weekend-barring-surpise-budget-deal/
25,McCarthy joins calls for Sen. Bob Menendez to resign after ‘very damaging’ indictment,,newsspotter,politics,1695600917.0,0.83,82,/r/politics/comments/16rd9df/mccarthy_joins_calls_for_sen_bob_menendez_to/,https://thehill.com/homenews/house/4220013-mccarthy-joins-calls-for-sen-bob-menendez-to-resign-after-very-damaging-indictment/
26,Santos says Menendez should not resign: ‘He’s innocent until proven guilty’,,naayve,politics,1695599718.0,0.78,101,/r/politics/comments/16rctpw/santos_says_menendez_should_not_resign_hes/,https://thehill.com/homenews/house/4221067-santos-says-menendez-should-not-resign-hes-innocent-until-proven-guilty/
27,UAW union files labor complaint against US Senator Tim Scott,,moo-a-dib,politics,1695562452.0,0.98,62,/r/politics/comments/16qxw30/uaw_union_files_labor_complaint_against_us/,https://www.reuters.com/business/autos-transportation/uaw-union-files-labor-complaint-against-us-senator-tim-scott-2023-09-23/
28,"Gen. Mark Milley, polarizing Joint Chiefs chairman, exits center stage",,Historical_Covering,politics,1695603786.0,0.79,63,/r/politics/comments/16reavh/gen_mark_milley_polarizing_joint_chiefs_chairman/,https://www.stripes.com/theaters/us/2023-09-24/gen-mark-milley-joint-chiefs-11475270.html
29,Oregon launches legal psilocybin access amid high demand,,0Ring-0,politics,1695559904.0,0.98,80,/r/politics/comments/16qx0v5/oregon_launches_legal_psilocybin_access_amid_high/,https://apnews.com/article/psilocybin-oregon-magic-mushrooms-psychedelics-therapy-legal-6e5389b090b0c50d5c90d9574b63eca5
30,Michigan GOP leader tells critics to “pound sand” amid pleas for unity at Mackinac,,walkinman19,politics,1695574742.0,0.96,72,/r/politics/comments/16r2ptn/michigan_gop_leader_tells_critics_to_pound_sand/,https://www.mlive.com/politics/2023/09/michigan-gop-leader-tells-critics-to-pound-sand-amid-pleas-for-unity-at-mackinac.html
31,McCarthy ally to GOP critics: ‘Get your little games over with’,,andrewarizona,politics,1695594035.0,0.94,9,/r/politics/comments/16ranut/mccarthy_ally_to_gop_critics_get_your_little/,https://thehill.com/homenews/house/4220986-mccarthy-ally-to-gop-critics-get-your-little-games-over-with/
32,"Adams Campaign Repeatedly Ignored Regulators’ Demands to Identify Supporters Behind $300,000 in Contributions",,Minimum-Net-7506,politics,1695616244.0,0.95,5,/r/politics/comments/16rifio/adams_campaign_repeatedly_ignored_regulators/,https://www.thecity.nyc/2023/9/22/23884825/eric-adams-campaign-finance-board-bundlers
33,"As Trump Prosecutions Move Forward, Threats and Concerns Increase",,LuklaAdvocate,politics,1695579506.0,0.95,40,/r/politics/comments/16r4nkz/as_trump_prosecutions_move_forward_threats_and/,https://www.nytimes.com/2023/09/24/us/politics/trump-prosecutions-threats-violence.html
34,"Government should pay compensation for secretive Cold War-era testing, St. Louis victims say",,GregWilson23,politics,1695575253.0,0.96,8,/r/politics/comments/16r2xgi/government_should_pay_compensation_for_secretive/,https://apnews.com/article/40f14597ceb9810fb4cdfba296221859
35,Biden campaign sending Gavin Newsom to Republican debate,,Drcockopus1,politics,1695525784.0,0.98,543,/r/politics/comments/16qn6tn/biden_campaign_sending_gavin_newsom_to_republican/,https://www.axios.com/2023/09/22/biden-deploys-newsom-gop-debate-president
36,What U.S taxpayers are getting for their money in Ukraine,,nosotros_road_sodium,politics,1695613805.0,0.75,73,/r/politics/comments/16rho79/what_us_taxpayers_are_getting_for_their_money_in/,https://www.cbsnews.com/news/us-aid-ukraine-60-minutes-transcript/
37,Is America uniquely vulnerable to tyranny?,,devlinadl,politics,1695556763.0,0.9,322,/r/politics/comments/16qvztp/is_america_uniquely_vulnerable_to_tyranny/,https://www.vox.com/23873476/america-democracy-authoritarianism-tyranny-minority-levitsky-ziblatt
38,California's controversial CARE Court brings mental health care into the courtroom,,nosotros_road_sodium,politics,1695612745.0,0.89,11,/r/politics/comments/16rhc32/californias_controversial_care_court_brings/,https://www.cbsnews.com/news/care-court-california-mental-illness-courtroom-plan-60-minutes-transcript/
39,"Matt Gaetz, Maria Bartiromo spar over government funding stalemate, Biden probes",,Investor9872,politics,1695572907.0,0.93,44,/r/politics/comments/16r1yg0/matt_gaetz_maria_bartiromo_spar_over_government/,https://thehill.com/homenews/house/4220568-matt-gaetz-maria-bartiromo-spar-over-government-funding-stalemate-biden-probes/
40,US House Problem Solvers Caucus issues framework to avert government shutdowns,,aslan_is_on_the_move,politics,1695619229.0,0.87,5,/r/politics/comments/16rjbjm/us_house_problem_solvers_caucus_issues_framework/,https://www.reuters.com/world/us/us-house-problem-solvers-caucus-issues-framework-avert-govt-shutdowns-2023-09-21/
41,Trump seeks to steal attention from GOP debate,,Investor9872,politics,1695570222.0,0.88,62,/r/politics/comments/16r0uop/trump_seeks_to_steal_attention_from_gop_debate/,https://thehill.com/homenews/campaign/4219149-trump-seeks-to-steal-attention-from-gop-debate/
42,"DeSantis drops Park Maitland School, other campuses from voucher programs because of China ties",,PM_HORSEDONGS,politics,1695594213.0,0.81,24,/r/politics/comments/16raqhu/desantis_drops_park_maitland_school_other/,"https://www.orlandosentinel.com/2023/09/22/schools-vouchers-china-desantis/#:~:text=PUBLISHED%3A%20September%2022%2C%202023%20at,DeSantis'%20office%20said%20late%20Friday."
43,Ron DeSantis’ Campaign Is Plummeting Because He Won’t Choose a Lane,,LuklaAdvocate,politics,1695521609.0,0.98,445,/r/politics/comments/16qluyb/ron_desantis_campaign_is_plummeting_because_he/,https://www.thedailybeast.com/ron-desantis-is-plummeting-because-he-wont-choose-a-lane
44,US education chief considers new ways to discourage college admissions preference for kids of alumni,,NoPomegranate4794,politics,1695572136.0,0.93,12,/r/politics/comments/16r1n0s/us_education_chief_considers_new_ways_to/,https://apnews.com/article/cardona-legacy-admissions-affirmative-action-education-53531b5ec2b48a3f4ab95be84d9b2a12
45,The Supreme Court will hear a case with a lot of ‘buts’ & ‘ifs’ over the meaning of ‘and’,,Politics_Knower,politics,1695579903.0,0.91,26,/r/politics/comments/16r4tca/the_supreme_court_will_hear_a_case_with_a_lot_of/,https://apnews.com/article/supreme-court-mandatory-minimum-sentencing-drug-crimes-235b5dd23cf70bead9f8f23d659a572d
46,John Fetterman Becomes First Senator to Call for Menendez Resignation,,TheMessengerNews,politics,1695501580.0,0.95,496,/r/politics/comments/16qennc/john_fetterman_becomes_first_senator_to_call_for/,https://themessenger.com/politics/john-fetterman-becomes-first-senator-to-call-for-menendez-resignation
47,Pete Buttigieg Explains the Difference Between Climate Change and Seasons to Republican Lawmaker,,Imaginary-Ocelot-167,politics,1695506322.0,0.97,373,/r/politics/comments/16qgicq/pete_buttigieg_explains_the_difference_between/,https://www.advocate.com/politics/pete-buttigieg-explains-climate-change
48,Trump says he always had autoworkers' backs. Union leaders say his first-term record shows otherwise,,PhysicalScholar4238,politics,1695519502.0,0.98,128,/r/politics/comments/16ql6oj/trump_says_he_always_had_autoworkers_backs_union/,https://apnews.com/article/labor-union-auto-workers-trump-strike-dfcb805fd4e749b13aaf827e1463da73
49,Simulated matchup between Biden and Trump falsely attributed to Reuters | Fact check,,RateTheNews,politics,1695563257.0,0.92,28,/r/politics/comments/16qy66w/simulated_matchup_between_biden_and_trump_falsely/,https://www.usatoday.com/story/news/factcheck/2023/09/22/2024-election-forecast-map-falsely-attributed-to-reuters-fact-check/70923483007/
50,'Whip-smart': This 22-year-old helps lead one of the largest school districts in Arizona,,hunter15991,politics,1695578587.0,0.87,3,/r/politics/comments/16r49xo/whipsmart_this_22yearold_helps_lead_one_of_the/,https://www.azcentral.com/story/news/local/arizona-people/2023/09/24/tempe-union-school-district-president-is-gen-z-leader-armando-montero/70837371007/
51,Clarence Thomas’ Koch Party Is Latest Shocking Ethics Breach,,marji80,politics,1695509679.0,0.98,204,/r/politics/comments/16qhs3z/clarence_thomas_koch_party_is_latest_shocking/,https://www.thedailybeast.com/clarence-thomas-koch-party-is-latest-shocking-ethics-breach-shan-wu-writes
52,What’s driving a possible shutdown? A fraction of the federal budget.,,rave_master555,politics,1695562681.0,0.89,39,/r/politics/comments/16qxyvd/whats_driving_a_possible_shutdown_a_fraction_of/,https://www.washingtonpost.com/business/2023/09/24/government-shutdown-congress-budget/
53,The State Where Republicans Are Breaking Their Own Rules to Stay in Power,,Redacted_rendition,politics,1695517093.0,0.98,94,/r/politics/comments/16qkdt7/the_state_where_republicans_are_breaking_their/,https://slate.com/news-and-politics/2023/09/wisconsin-republicans-janet-protasiewicz-supreme-court-gerrymandering-impeachment-democracy.html
54,Trump plays up anti-abortion credentials following recent criticism,,devlinadl,politics,1695580501.0,0.78,20,/r/politics/comments/16r525h/trump_plays_up_antiabortion_credentials_following/,https://www.newsweek.com/trump-plays-anti-abortion-credentials-following-recent-criticism-1829430
55,Gold Bullion and Halal Meat: Inside the Menendez Investigation,,dtallee,politics,1695568558.0,0.93,17,/r/politics/comments/16r06oe/gold_bullion_and_halal_meat_inside_the_menendez/,https://www.nytimes.com/2023/09/23/nyregion/bob-menendez-indictment-bribery-investigation.html?unlocked_article_code=WMik80E9UkOWMEiuxPqqHckK7UEVQ8yBQl8zMMZHBooeZUZ1a8fBLZ-px_kcBzW3pcHj6ukCQnx4HJqOTFb2y6Zao-9Oyt5D8TeAP5iaJV3cn_MR__Tgl2JaAtkIXTMFKDClBJe38gEfGIhMaoxygo5x_oW_lJznZSf20t1fblLZ9VtsYYKaDOTlrcwZRpT75rhKFlmyGO3jUqf6gVo8tFyShmwvWmS39NT9xvnklc5NSOiMp_5VFYIzmZ0pNXmxnsDZS1bmq7iEEhxGbuzUBXOXwUmsrRk9qK6vmRl-zluNxDJfAlZo9rUxsatuKK-suRUK7wT5nrOAQZPJ6GMiYR5TkSfo4j_ouD8T6hvAWQnew1grncKM0g&smid=url-share
56,"Chris Christie rules out running for indicted New Jersey Sen. Bob Menendez's seat | “I have no interest in being in the United States Senate,” Christie said in an exclusive interview on NBC News' ""Meet the Press.""",,Politics_Knower,politics,1695590946.0,0.83,10,/r/politics/comments/16r9dfl/chris_christie_rules_out_running_for_indicted_new/,https://www.nbcnews.com/politics/2024-election/chris-christie-rules-running-indicted-new-jersey-j-sen-bob-menendezs-s-rcna117055
57,"PragerU’s Propaganda Is Now Being Taught in Schools. The media group was just approved to spread its brand of historical disinformation to classrooms in Florida, Oklahoma, and New Hampshire.",,southpawFA,politics,1695497931.0,0.96,378,/r/politics/comments/16qd8ei/pragerus_propaganda_is_now_being_taught_in/,https://progressive.org/public-schools-advocate/pragerus-propaganda-is-now-being-taught-schools-mccoy-230918/
58,"U.S. braces for costly government shutdown in eight days | Federal workers and military service members won’t be paid, while federal programs — from some food safety inspections to child-care funds — come to an abrupt halt",,grab-n-g0,politics,1695531716.0,0.97,199,/r/politics/comments/16qoxjm/us_braces_for_costly_government_shutdown_in_eight/,https://www.washingtonpost.com/business/2023/09/22/us-braces-calamitous-costly-government-shutdown-eight-days/
59,"Despite efforts of 3 U.S. administrations, migrant families keep crossing the border",,nosotros_road_sodium,politics,1695577738.0,0.84,76,/r/politics/comments/16r3x5v/despite_efforts_of_3_us_administrations_migrant/,https://www.npr.org/2023/09/23/1201233986/migrant-families-border-illegal-immigration
60,Revelations of Clarence Thomas’s Koch links stoke supreme court reform calls,,3kOlen,politics,1695520160.0,0.98,42,/r/politics/comments/16qle6j/revelations_of_clarence_thomass_koch_links_stoke/,https://www.theguardian.com/us-news/2023/sep/22/clarence-thomas-koch-revelations-calls-supreme-court-reform
61,Joe Biden Is About to Go Where No President Has Gone Before—A Picket Line.,,temporarycreature,politics,1695485688.0,0.97,768,/r/politics/comments/16q8gwo/joe_biden_is_about_to_go_where_no_president_has/,https://www.motherjones.com/politics/2023/09/joe-biden-is-about-to-go-where-no-president-has-gone-before/
62,Clarence Thomas’ Latest Pay-to-Play Scandal Finally Connects All the Dots,,fritzduhkat,politics,1695477025.0,0.94,990,/r/politics/comments/16q51wn/clarence_thomas_latest_paytoplay_scandal_finally/,https://slate.com/news-and-politics/2023/09/clarence-thomas-chevron-ethics-kochs.html?via=rss
63,Donald Trump commits to Nevada caucus as state GOP approves rules rivals see as helping his campaign,,heroini,politics,1695558223.0,0.89,21,/r/politics/comments/16qwh2i/donald_trump_commits_to_nevada_caucus_as_state/,https://apnews.com/article/nevada-gop-donald-trump-caucus-066ce2bc1a272650d944c61f1d73cdc2
64,Cassidy Hutchinson says Mark Meadows burned so many documents before leaving the White House that the then-chief of staff's wife complained about dry-cleaning bills to remove the 'bonfire' smell: report,,naayve,politics,1695487849.0,0.98,342,/r/politics/comments/16q9aw8/cassidy_hutchinson_says_mark_meadows_burned_so/,https://www.businessinsider.com/cassidy-hutchinson-meadows-wife-dry-cleaning-expenses-fireplace-documents-trump-2023-9
65,"Jeffries: Impeachment inquiry is ‘kangaroo court, fishing expedition and conspiracy theater’",,aslan_is_on_the_move,politics,1695535124.0,0.96,20,/r/politics/comments/16qpv68/jeffries_impeachment_inquiry_is_kangaroo_court/,https://thehill.com/homenews/house/4200912-jeffries-impeachment-inquiry-is-kangaroo-court-fishing-expedition-and-conspiracy-theater/
66,"Make no mistake, it's absolutely possible Trump wins the 2024 election",,Nearby-Astronomer298,politics,1695478959.0,0.86,3075,/r/politics/comments/16q5sqi/make_no_mistake_its_absolutely_possible_trump/,https://www.businessinsider.com/its-absolutely-possible-trump-wins-the-2024-election-2023-9
67,Rep. Andy Kim announces he'll run against NJ Sen. Bob Menendez in wake of his indictment,,lankymapl,politics,1695499111.0,0.99,88,/r/politics/comments/16qdomx/rep_andy_kim_announces_hell_run_against_nj_sen/,https://edition.cnn.com/2023/09/23/politics/menendez-andy-kim-senate/index.html
68,"Chicago Is About to End the Subminimum Wage for Tipped Workers - Brandon Johnson, the labor-backed mayor of Chicago, is poised to deliver his first major victory: scrapping the subminimum wage for tipped workers.",,Picture-unrelated,politics,1695507648.0,0.98,168,/r/politics/comments/16qh0wm/chicago_is_about_to_end_the_subminimum_wage_for/,https://jacobin.com/2023/09/chicago-brandon-johnson-subminimum-wage-tipped-workers-restaurant-industry
69,The history of government shutdowns and how long they last,,axios,politics,1695562814.0,0.96,21,/r/politics/comments/16qy0ie/the_history_of_government_shutdowns_and_how_long/,https://www.axios.com/2023/09/24/federal-government-shutdown-history-list
70,Mark Milley claims Trump made shocking comment about disabled veteran: ‘No one wants to see that’,,ChocolateTsar,politics,1695501547.0,0.98,194,/r/politics/comments/16qen7i/mark_milley_claims_trump_made_shocking_comment/,https://www.independent.co.uk/news/world/americas/mark-milley-trump-comments-wounded-veteran-b2416616.html
71,"A small New York hedge fund has secretly managed $7 billion for a Russian oligarch for over a decade, the SEC says",,Professional_Cod_754,politics,1695498862.0,0.98,102,/r/politics/comments/16qdlag/a_small_new_york_hedge_fund_has_secretly_managed/,https://markets.businessinsider.com/news/stocks/russia-war-in-ukraine-hedge-funds-oligarchs-roman-abramovich-sec-2023-9
72,"McCarthy backtracks, says he will keep Ukraine aid in Pentagon funding bill",,Quirkie,politics,1695495459.0,0.98,162,/r/politics/comments/16qca0w/mccarthy_backtracks_says_he_will_keep_ukraine_aid/,https://thehill.com/homenews/house/4220034-mccarthy-backtracks-says-he-will-keep-ukraine-aid-in-pentagon-funding-bill/
73,U.S. Senator Peters expresses concern about Nagorno-Karabakh situation,,aslan_is_on_the_move,politics,1695573516.0,0.85,3,/r/politics/comments/16r27n5/us_senator_peters_expresses_concern_about/,https://www.reuters.com/world/us-senator-peters-expresses-concern-about-nagorno-karabakh-situation-2023-09-23/
74,Air Defense Remains Top Priority at Meeting on Ukraine Defense,,Art_Is_A_Confession,politics,1695625091.0,1.0,1,/r/politics/comments/16rkxq3/air_defense_remains_top_priority_at_meeting_on/,https://www.defense.gov/News/News-Stories/Article/Article/3531013/air-defense-remains-top-priority-at-meeting-on-ukraine-defense/
75,Joe Biden claims that Hispanic unemployment has been cut in half. That’s Mostly True.,,aslan_is_on_the_move,politics,1695509242.0,0.97,155,/r/politics/comments/16qhmev/joe_biden_claims_that_hispanic_unemployment_has/,https://www.politifact.com/factchecks/2023/sep/22/joe-biden/joe-biden-claims-that-hispanic-unemployment-has-be/
