,title,selftext,author,subreddit,created_utc,upvote_ratio,num_comments,permalink,url
76,"New Population Counts for Nearly 1,500 Race and Ethnicity Groups",,bambin0,politics,1695623375.0,0.83,3,/r/politics/comments/16rkhad/new_population_counts_for_nearly_1500_race_and/,https://www.census.gov/library/stories/2023/09/2020-census-dhc-a-race-overview.html
77,A Black student’s family sues Texas officials over his suspension for his hairstyle,,GregWilson23,politics,1695487528.0,0.97,283,/r/politics/comments/16q96bd/a_black_students_family_sues_texas_officials_over/,https://apnews.com/article/e79ede512923b672a275abf054e2407b
78,Why America Should Send Military Advisers to Ukraine / On-the-Ground Help Will Bolster Kyiv Without Risking Escalation,,Art_Is_A_Confession,politics,1695626100.0,0.64,8,/r/politics/comments/16rl7sh/why_america_should_send_military_advisers_to/,https://www.foreignaffairs.com/united-states/why-america-should-send-military-advisers-ukraine
79,Cassidy Hutchinson says she once encountered MyPillow CEO Mike Lindell exploring the White House unescorted,,rillzy,politics,1695490454.0,0.98,116,/r/politics/comments/16qac52/cassidy_hutchinson_says_she_once_encountered/,https://www.businessinsider.com/cassidy-hutchinson-mike-lindell-trump-white-house-unattended-2020-election-2023-9
80,"Pentagon Tackling Nuclear Modernization With Proactive, Integrated Approach",,Art_Is_A_Confession,politics,1695625163.0,1.0,1,/r/politics/comments/16rkye0/pentagon_tackling_nuclear_modernization_with/,https://www.defense.gov/News/News-Stories/Article/Article/3505989/pentagon-tackling-nuclear-modernization-with-proactive-integrated-approach/
81,"How Texas became the new ""homebase"" for white nationalist and neo-Nazi groups",,Redacted_rendition,politics,1695473626.0,0.93,722,/r/politics/comments/16q3sz6/how_texas_became_the_new_homebase_for_white/,https://www.salon.com/2023/09/23/how-texas-became-the-new-homebase-for-nationalist-and-neo-nazi-groups/
82,Exasperated GOP leaders vent frustration at holdouts as shutdown nears,,malcolm58,politics,1695521914.0,0.97,66,/r/politics/comments/16qlyj8/exasperated_gop_leaders_vent_frustration_at/,https://thehill.com/homenews/house/4220206-exasperated-gop-leaders-vent-frustration-at-holdouts-as-shutdown-nears/
83,Both parties want to win South Florida. Here’s one Cuban activist’s view of the political fight,,Majano57,politics,1695569792.0,0.69,32,/r/politics/comments/16r0oen/both_parties_want_to_win_south_florida_heres_one/,https://apnews.com/article/south-florida-latino-politics-cuban-americans-d38ec18a07310f26a02f7bae8726d26d
84,Nikki Haley's Approach to Abortion Is Rooted in Her Earliest Days in South Carolina Politics,,JimmieAbbott44,politics,1695575046.0,0.64,22,/r/politics/comments/16r2ujv/nikki_haleys_approach_to_abortion_is_rooted_in/,https://www.usnews.com/news/politics/articles/2023-09-23/nikki-haleys-approach-to-abortion-is-rooted-in-her-earliest-days-in-south-carolina-politics
85,"Sen. Amy Klobuchar on drug reform: Big Pharma ""spent hundreds of millions — and the public won"" | Minnesota senator and anti-monopoly crusader explains how fixing Medicare's drug problem will help everybody",,Picture-unrelated,politics,1695517063.0,0.97,12,/r/politics/comments/16qkdfj/sen_amy_klobuchar_on_drug_reform_big_pharma_spent/,https://www.salon.com/2023/09/23/sen-amy-klobuchar-on-reform-big-pharma-spent-hundreds-of-millions--and-the-public-won/
86,‘This is horrifying’: Top New Jersey Democrats call on Bob Menendez to resign after his second indictment,,OmahaWinter,politics,1695496147.0,0.98,63,/r/politics/comments/16qcjs4/this_is_horrifying_top_new_jersey_democrats_call/,https://www.politico.com/news/2023/09/22/new-jersey-democrats-menendez-indictment-00117693
87,Biden supporting the UAW strike on the picket line,,321beachlife,politics,1695473861.0,0.98,456,/r/politics/comments/16q3vxu/biden_supporting_the_uaw_strike_on_the_picket_line/,https://amp.cnn.com/cnn/2023/09/22/politics/joe-biden-michigan-trip-uaw/index.html?fbclid=IwAR1WHvbjhORoZR6Z3X3rxQ0xR-vCv_sWa_rD7a45gOrv-lb8-dSMXBc7n54
88,Speaker McCarthy is giving hard-right Republicans what they want. But it never seems to be enough.,,Majano57,politics,1695516974.0,0.94,106,/r/politics/comments/16qkcfv/speaker_mccarthy_is_giving_hardright_republicans/,https://apnews.com/article/government-shutdown-congress-mccarthy-gaetz-republicans-dd94770223f697c1c68229133f031df4
89,The right’s censorship campaign is growing more ambitious — and threatening,,brithus,politics,1695517021.0,0.93,31,/r/politics/comments/16qkcyo/the_rights_censorship_campaign_is_growing_more/,https://www.msnbc.com/opinion/msnbc-opinion/book-ban-censorship-library-rcna111405
90,"Menendez should resign from Senate, Pa.'s Fetterman says",,Politics_Knower,politics,1695501548.0,0.97,28,/r/politics/comments/16qen80/menendez_should_resign_from_senate_pas_fetterman/,https://www.post-gazette.com/news/politics-state/2023/09/23/robert-menendez-indictment-john-fetterman/stories/202309230080
91,DOJ move for gag order in Trump Jan. 6 case puts judge in tough spot,,Investor9872,politics,1695479081.0,0.97,158,/r/politics/comments/16q5ugb/doj_move_for_gag_order_in_trump_jan_6_case_puts/,https://thehill.com/regulation/court-battles/4219119-doj-gag-order-trump-jan-6-case-puts-judge-tough-spot/
92,Bob Menendez steps down as US Senate foreign relations chairman after indictment,,Agreeable-Strategy10,politics,1695480787.0,0.99,150,/r/politics/comments/16q6igh/bob_menendez_steps_down_as_us_senate_foreign/,https://www.bbc.com/news/world-us-canada-66897845
93,Newsom vetoes bill requiring custody hearings consider affirmation of child’s gender identity,,Separate_Explorer300,politics,1695528958.0,0.88,51,/r/politics/comments/16qo4ru/newsom_vetoes_bill_requiring_custody_hearings/,https://www.latimes.com/california/story/2023-09-23/newsom-vetoes-bill-requiring-custody-hearings-consider-affirmation-of-childs-gender-identity
94,"With House Republicans in turmoil, colleagues implore GOP holdouts not to shut down government",,Majano57,politics,1695515839.0,0.96,28,/r/politics/comments/16qjz2d/with_house_republicans_in_turmoil_colleagues/,https://apnews.com/article/shutdown-mccarthy-congress-house-republicans-biden-249d83636e9d61cdd2aabdf34a129514
95,"Mouths Full of Blood: Trump and His Backers Spread Lies, Violence and Fascism — Death threats have become rampant as MAGA culture twists norms and makes once-marginal forms of violence mainstream.",,temporarycreature,politics,1695484161.0,0.94,96,/r/politics/comments/16q7v4c/mouths_full_of_blood_trump_and_his_backers_spread/,https://truthout.org/articles/mouths-full-of-blood-trump-and-his-backers-spread-lies-violence-and-fascism/
96,"Roger Stone issues warning to Matt Gaetz about ""weasel"" DeSantis",,BelleAriel,politics,1695490445.0,0.95,131,/r/politics/comments/16qac0k/roger_stone_issues_warning_to_matt_gaetz_about/,https://www.newsweek.com/roger-stone-issues-warning-matt-gaetz-about-weasel-desantis-1829362
97,U.S. to give Ukraine an additional $325 million in military aid,,bbcjay718,politics,1695513616.0,0.93,84,/r/politics/comments/16qj74o/us_to_give_ukraine_an_additional_325_million_in/,https://www.nbcnews.com/news/amp-video/mmvo193536069744
98,GOP Prez Wannabes’ Plans for Government: Dangerous—and Really Dumb | Each wants to shrink government more than the last. And none of them knows a lick about how the federal government actually works.,,thenewrepublic,politics,1695500876.0,0.94,27,/r/politics/comments/16qedol/gop_prez_wannabes_plans_for_government/,https://newrepublic.com/article/175689/2024-republicans-wreck-civil-service
99,FBI Warned Sikhs in the U.S. About Death Threats After Killing of Canadian Activist,,Lazy_Matter_4876,politics,1695514042.0,0.92,11,/r/politics/comments/16qjcug/fbi_warned_sikhs_in_the_us_about_death_threats/,https://theintercept.com/2023/09/23/sikhs-fbi-canada-india-nijjar/
